question_id,subject,class,chapter_number,chapter_title,medium,difficulty,answer_type,marks,text,options,key_answer,exam_type,year,group_heading,chapter_id,standard,found_in_pdf,match_score,pdf_source,pdf_section
6982ff0697c92115623a586c,science,7,3.0,Motion and Time,english,Average,mcq,1.0,Motion of eight planets around the Sun,"[""Periodic motion"", ""Rectilinear motion"", ""Circular, rotational motion"", ""Revolutionary motion""]",Keep it empty for now,LBA,2025-26,Multiple Choice Questions,67449b18065a2c5cd2dca5c1,7,False,42.10526315789473,science_7.pdf,And
6982ff0697c92115623a5872,science,7,3.0,Motion and Time,english,Difficult,mcq,1.0,"In the image below, if Rani starts from A and reaches B, then from B to C, then from 
C to D, and then from D to E, her total distance traveled","[""32 m"", ""39 m"", ""33 m"", ""23 m""]",Keep it empty for now,LBA,2025-26,Multiple Choice Questions,67449b18065a2c5cd2dca5c1,7,False,42.25352112676056,science_7.pdf,And
6982ff0697c92115623a587b,science,7,3.0,Motion and Time,english,Difficult,mcq,1.0,The distance time graphs shows a truck moving with speed which is not constant,"[""\u2170"", ""\u2171"", ""\u2172"", ""\u2173""]",Keep it empty for now,LBA,2025-26,Multiple Choice Questions,67449b18065a2c5cd2dca5c1,7,False,46.15384615384615,science_7.pdf,And
6982ff0697c92115623a5881,science,7,3.0,Motion and Time,english,Easy,mcq,1.0,International unit of measurement for speed is,"[""km/h"", ""meter/second"", ""Second"", ""Kilogram""]",Keep it empty for now,LBA,2025-26,Multiple Choice Questions,67449b18065a2c5cd2dca5c1,7,False,45.652173913043484,science_7.pdf,And
6982ff0697c92115623a5884,science,7,3.0,Motion and Time,english,Easy,mcq,1.0,"In uniform motion, distance is covered as","[""Unequal"", ""Less"", ""Equal"", ""Zero""]",Keep it empty for now,LBA,2025-26,Multiple Choice Questions,67449b18065a2c5cd2dca5c1,7,False,46.34146341463414,science_7.pdf,And
6982ff0697c92115623a5886,science,7,3.0,Motion and Time,english,Easy,fill_in_the_blank,1.0,"If motion has both direction and distance, it is called ___________.",[],Required Answer,LBA,2025-26,Fill in the Blanks,67449b18065a2c5cd2dca5c1,7,False,45.58823529411765,science_7.pdf,And
6982ff0697c92115623a5888,science,7,3.0,Motion and Time,english,Easy,fill_in_the_blank,1.0,The ___________ instrument is used to indicate speed.,[],Required Answer,LBA,2025-26,Fill in the Blanks,67449b18065a2c5cd2dca5c1,7,False,43.39622641509434,science_7.pdf,And
6982ff0697c92115623a588b,science,7,3.0,Motion and Time,english,Easy,fill_in_the_blank,1.0,Speed = ___________ ÷ Time.,[],Required Answer,LBA,2025-26,Fill in the Blanks,67449b18065a2c5cd2dca5c1,7,False,28.000000000000004,science_7.pdf,And
6982ff0697c92115623a588e,science,7,3.0,Motion and Time,english,Easy,fill_in_the_blank,1.0,Distance travelled = Speed × ___________.,[],Required Answer,LBA,2025-26,Fill in the Blanks,67449b18065a2c5cd2dca5c1,7,False,35.89743589743589,science_7.pdf,And
6982ff0697c92115623a586b,science,7,3.0,Motion and Time,english,Average,mcq,1.0,An example of oscillatory/periodic motion.,"[""Motion of a bus"", ""Motion of a swing"", ""Motion of an ox in a sugarcane press"", ""Motion of the Earth around the Sun""]",Keep it empty for now,LBA,2025-26,Multiple Choice Questions,67449b18065a2c5cd2dca5c1,7,False,42.85714285714286,science_7.pdf,And
6982ff0697c92115623a586e,science,7,3.0,Motion and Time,english,Easy,mcq,1.0,An example of rectilinear motion,"[""Motion of clock hands"", ""Motion of a train"", ""Motion of a snake"", ""Motion of a swing""]",Keep it empty for now,LBA,2025-26,Multiple Choice Questions,67449b18065a2c5cd2dca5c1,7,False,43.75,science_7.pdf,And
6982ff0697c92115623a586f,science,7,3.0,Motion and Time,english,Easy,mcq,1.0,International unit of speed,"[""Meter per second (m/s)"", ""Centimetre per second (cm/s)"", ""Millimetre per second (mm/s)"", ""Kilometre per second (km/s)""]",Keep it empty for now,LBA,2025-26,Multiple Choice Questions,67449b18065a2c5cd2dca5c1,7,False,48.14814814814815,science_7.pdf,And
6982ff0697c92115623a5870,science,7,3.0,Motion and Time,english,Average,mcq,1.0,Formula used to find speed,"[""Speed = Distance travelled \u00f7 Time taken"", ""Speed = Time taken \u00f7 Distance travelled"", ""Speed = Distance travelled \u00d7 Time"", ""Speed = Acceleration \u00d7 Time""]",Keep it empty for now,LBA,2025-26,Multiple Choice Questions,67449b18065a2c5cd2dca5c1,7,False,46.15384615384615,science_7.pdf,And
6982ff0697c92115623a5871,science,7,3.0,Motion and Time,english,Average,mcq,1.0,Distance covered by a bus traveling at a speed of 60 km/h in 20 minutes,"[""80 km"", ""120 km"", ""30 km"", ""40 km""]",Keep it empty for now,LBA,2025-26,Multiple Choice Questions,67449b18065a2c5cd2dca5c1,7,False,39.43661971830986,science_7.pdf,And
6982ff0697c92115623a5875,science,7,3.0,Motion and Time,english,Average,mcq,1.0,Body A covers a certain distance in less time than Body,"[""Here, the speed of Body A \nis"", ""Less than the speed of Body"", ""B. Greater than the speed of Body"", ""C. Equal to the speed of Body""]",Keep it empty for now,LBA,2025-26,Multiple Choice Questions,67449b18065a2c5cd2dca5c1,7,False,45.45454545454546,science_7.pdf,And
6982ff0697c92115623a5878,science,7,3.0,Motion and Time,english,Difficult,mcq,1.0,"According to this distance-time graph, the speed of the object is","[""20 m/s"", ""80 m/s"", ""5 m/s"", ""4 m/s""]",Keep it empty for now,LBA,2025-26,Multiple Choice Questions,67449b18065a2c5cd2dca5c1,7,False,46.15384615384615,science_7.pdf,And
6982ff0697c92115623a586d,science,7,3.0,Motion and Time,english,Easy,mcq,1.0,Instrument for measuring the distance travelled by a scooter,"[""Odometer"", ""Thermometer"", ""Temperature gauge"", ""Lactometer""]",Keep it empty for now,LBA,2025-26,Multiple Choice Questions,67449b18065a2c5cd2dca5c1,7,False,46.666666666666664,science_7.pdf,And
6982ff0697c92115623a5873,science,7,3.0,Motion and Time,english,Difficult,mcq,1.0,"If an object moving in a circular path starts from point A and returns to point A again, 
the distance it traveled is","[""\ud835\udf0b\ud835\udc5f2"", ""2\ud835\udf0b\ud835\udc5f"", ""\ud835\udf0b\ud835\udc5f"", ""\ud835\udf0b\ud835\udc5f3""]",Keep it empty for now,LBA,2025-26,Multiple Choice Questions,67449b18065a2c5cd2dca5c1,7,False,41.379310344827594,science_7.pdf,And
6982ff0697c92115623a587c,science,7,3.0,Motion and Time,english,Average,mcq,1.0,"In this bar chart (distance-time graph), which person has run more runs?","[""Person E"", ""Person F"", ""Person B"", ""Person C""]",Keep it empty for now,LBA,2025-26,Multiple Choice Questions,67449b18065a2c5cd2dca5c1,7,False,44.44444444444444,science_7.pdf,And
6982ff0697c92115623a587d,science,7,3.0,Motion and Time,english,Average,mcq,1.0,Speed and velocity are different from each other because,"[""They have the same direction and magnitude"", ""The magnitude may be the same but the direction may be different"", ""Both have the same magnitude"", ""Both may have the same direction""]",Keep it empty for now,LBA,2025-26,Multiple Choice Questions,67449b18065a2c5cd2dca5c1,7,False,42.85714285714286,science_7.pdf,And
6982ff0697c92115623a587f,science,7,3.0,Motion and Time,english,Easy,mcq,1.0,The unit commonly used to measure distance of motion,"[""Second"", ""Meter"", ""Litre"", ""Gram""]",Keep it empty for now,LBA,2025-26,Multiple Choice Questions,67449b18065a2c5cd2dca5c1,7,False,48.54368932038835,science_7.pdf,And
6982ff0697c92115623a5880,science,7,3.0,Motion and Time,english,Average,mcq,1.0,Speed can be calculated as,"[""Time \u00f7 Distance"", ""Distance \u00f7 Time"", ""Speed \u00d7 Time"", ""Time \u00d7 Direction""]",Keep it empty for now,LBA,2025-26,Multiple Choice Questions,67449b18065a2c5cd2dca5c1,7,False,42.553191489361694,science_7.pdf,And
6982ff0697c92115623a5882,science,7,3.0,Motion and Time,english,Easy,mcq,1.0,Example of uniform motion is,"[""A running person"", ""Clock hands"", ""A cyclist"", ""Blowing wind""]",Keep it empty for now,LBA,2025-26,Multiple Choice Questions,67449b18065a2c5cd2dca5c1,7,False,44.44444444444444,science_7.pdf,And
6982ff0697c92115623a5887,science,7,3.0,Motion and Time,english,Easy,fill_in_the_blank,1.0,"In a clock, one hour = ___________ minutes.",[],Required Answer,LBA,2025-26,Fill in the Blanks,67449b18065a2c5cd2dca5c1,7,False,37.2093023255814,science_7.pdf,And
6982ff0697c92115623a5889,science,7,3.0,Motion and Time,english,Easy,fill_in_the_blank,1.0,1 hour = ___________ seconds.,[],Required Answer,LBA,2025-26,Fill in the Blanks,67449b18065a2c5cd2dca5c1,7,False,32.14285714285714,science_7.pdf,And
6982ff0697c92115623a588a,science,7,3.0,Motion and Time,english,Easy,fill_in_the_blank,1.0,The SI unit for measuring time is ___________.,[],Required Answer,LBA,2025-26,Fill in the Blanks,67449b18065a2c5cd2dca5c1,7,False,39.13043478260869,science_7.pdf,And
6982ff0697c92115623a588c,science,7,3.0,Motion and Time,english,Easy,fill_in_the_blank,1.0,"In uniform motion, an object covers ___________ distance.",[],Required Answer,LBA,2025-26,Fill in the Blanks,67449b18065a2c5cd2dca5c1,7,False,40.35087719298246,science_7.pdf,And
6982ff0697c92115623a5874,science,7,3.0,Motion and Time,english,Difficult,mcq,1.0,"In the image, if an object starts from A, reaches B, and then arrives at C, its 
displacement is","[""13 m"", ""12 m"", ""17 m"", ""5 m""]",Keep it empty for now,LBA,2025-26,Multiple Choice Questions,67449b18065a2c5cd2dca5c1,7,False,44.21052631578948,science_7.pdf,And
6982ff0697c92115623a5876,science,7,3.0,Motion and Time,english,Difficult,mcq,1.0,"The distance from Bengaluru to Mumbai is 1200 km. If a bus takes 10 hours to cover 
this distance, the speed of the bus is","[""510 km/h"", ""120 km/h"", ""12000 km/h"", ""50 km/h""]",Keep it empty for now,LBA,2025-26,Multiple Choice Questions,67449b18065a2c5cd2dca5c1,7,False,40.49586776859504,science_7.pdf,And
6982ff0697c92115623a5877,science,7,3.0,Motion and Time,english,Easy,mcq,1.0,The factor that determines if one car is moving faster than another,"[""Speed"", ""Force"", ""Pressure"", ""Weight""]",Keep it empty for now,LBA,2025-26,Multiple Choice Questions,67449b18065a2c5cd2dca5c1,7,False,43.28358208955224,science_7.pdf,And
6982ff0697c92115623a5879,science,7,3.0,Motion and Time,english,Average,mcq,1.0,"Among these distance-time graphs, the graph indicating uniform motion is    
 
A.  
                B. 
 
C.   
                D.",[],Keep it empty for now,LBA,2025-26,Multiple Choice Questions,67449b18065a2c5cd2dca5c1,7,False,44.047619047619044,science_7.pdf,And
6982ff0697c92115623a587a,science,7,3.0,Motion and Time,english,Difficult,mcq,1.0,"The distance between two stations is 120 km. If a train takes 4 hours to cover this 
distance, calculate the speed of the train.","[""480 km/h"", ""30 km/h"", ""240 km/h"", ""120 km/h""]",Keep it empty for now,LBA,2025-26,Multiple Choice Questions,67449b18065a2c5cd2dca5c1,7,False,40.16064257028113,science_7.pdf,And
6982ff0697c92115623a587e,science,7,3.0,Motion and Time,english,Average,mcq,1.0,"According to this graph, object P is","[""Moving with non-uniform speed."", ""Moving with uniform speed."", ""At rest"", ""Moving with high speed.""]",Keep it empty for now,LBA,2025-26,Multiple Choice Questions,67449b18065a2c5cd2dca5c1,7,False,44.44444444444444,science_7.pdf,And
6982ff0697c92115623a5883,science,7,3.0,Motion and Time,english,Easy,mcq,1.0,Instrument for measuring time is,"[""Meter stick"", ""Clock"", ""Weights"", ""Lactometer""]",Keep it empty for now,LBA,2025-26,Multiple Choice Questions,67449b18065a2c5cd2dca5c1,7,True,50.0,science_7.pdf,And
6982ff0697c92115623a5885,science,7,3.0,Motion and Time,english,Average,mcq,1.0,The graph used to show motion is,"[""Time-distance graph"", ""Line graph"", ""Bar graph"", ""Pie chart""]",Keep it empty for now,LBA,2025-26,Multiple Choice Questions,67449b18065a2c5cd2dca5c1,7,False,46.875,science_7.pdf,And
6982ff0697c92115623a588d,science,7,3.0,Motion and Time,english,Easy,fill_in_the_blank,1.0,The SI unit of speed is ___________.,[],Required Answer,LBA,2025-26,Fill in the Blanks,67449b18065a2c5cd2dca5c1,7,False,38.888888888888886,science_7.pdf,And
6982ff0697c92115623a588f,science,7,3.0,Motion and Time,english,Difficult,match_the_following,1.0,"A                                            B  
      i. Time                           1. Equal distance covered in equal time  
     ii. Speed                         2. Object at rest  
    iii. Stationary object        3. Second  
    iv. Uniform motion         4. Distance ÷ Time",[],Keep it empty for now,LBA,2025-26,Match the Following,67449b18065a2c5cd2dca5c1,7,False,39.189189189189186,science_7.pdf,And
6982ff0697c92115623a5892,science,7,3.0,Motion and Time,english,Easy,short_answer,1.0,What is the SI unit of time?,[],Required Answer,LBA,2025-26,One Sentence Answers,67449b18065a2c5cd2dca5c1,7,False,42.85714285714286,science_7.pdf,And
6982ff0697c92115623a5895,science,7,3.0,Motion and Time,english,Average,short_answer,1.0,Name an example of uniform motion.,[],Required Answer,LBA,2025-26,One Sentence Answers,67449b18065a2c5cd2dca5c1,7,False,43.333333333333336,science_7.pdf,And
6982ff0697c92115623a589b,science,7,3.0,Motion and Time,english,Average,short_answer,2.0,Why is uniform motion called tireless motion?,[],Required Answer,LBA,2025-26,Answer in Two Sentences,67449b18065a2c5cd2dca5c1,7,False,44.44444444444444,science_7.pdf,And
6982ff0697c92115623a589c,science,7,3.0,Motion and Time,english,Difficult,short_answer,2.0,How is speed an indicator of motion's progress?,[],Required Answer,LBA,2025-26,Answer in Two Sentences,67449b18065a2c5cd2dca5c1,7,False,42.553191489361694,science_7.pdf,And
6982ff0697c92115623a589f,science,7,3.0,Motion and Time,english,Difficult,fill_in_the_blank,4.0,Explain uniform and non-uniform motion.,[],Required Answer,LBA,2025-26,Answer in Four Sentences,67449b18065a2c5cd2dca5c1,7,False,46.15384615384615,science_7.pdf,And
6982ff0697c92115623a58a0,science,7,3.0,Motion and Time,english,Difficult,fill_in_the_blank,4.0,Write the three main types of motion with examples.,[],Required Answer,LBA,2025-26,Answer in Four Sentences,67449b18065a2c5cd2dca5c1,7,False,41.17647058823529,science_7.pdf,And
6982ff0697c92115623a58a9,science,7,3.0,Motion and Time,english,Difficult,fill_in_the_blank,1.0,Home Activity:,[],Required Answer,LBA,2025-26,Short Answers,67449b18065a2c5cd2dca5c1,7,False,43.47826086956522,science_7.pdf,And
6982ff0697c92115623a58ab,science,7,3.0,Motion and Time,english,Average,fill_in_the_blank,1.0,Time Measurement Activity:,[],Required Answer,LBA,2025-26,Short Answers,67449b18065a2c5cd2dca5c1,7,False,42.307692307692314,science_7.pdf,And
6982ff0697c92115623a5890,science,7,3.0,Motion and Time,english,Difficult,match_the_following,1.0,"A                                           B  
i. Speedometer                    1. Measuring time  
ii. Clock                              2. Measuring distance traveled  
iii. Uniform motion            3. Measuring speed  
iv. Non-uniform motion     4. Covering equal distance  
v. Odometer                        5. Covering unequal distance",[],Keep it empty for now,LBA,2025-26,Match the Following,67449b18065a2c5cd2dca5c1,7,False,40.57971014492754,science_7.pdf,And
6982ff0697c92115623a5891,science,7,3.0,Motion and Time,english,Average,short_answer,1.0,What is the formula to calculate speed?,[],Required Answer,LBA,2025-26,One Sentence Answers,67449b18065a2c5cd2dca5c1,7,False,41.02564102564102,science_7.pdf,And
6982ff0697c92115623a5893,science,7,3.0,Motion and Time,english,Average,short_answer,1.0,What is repetitive motion called?,[],Required Answer,LBA,2025-26,One Sentence Answers,67449b18065a2c5cd2dca5c1,7,False,42.42424242424242,science_7.pdf,And
6982ff0697c92115623a5896,science,7,3.0,Motion and Time,english,Easy,short_answer,2.0,What is a stationary object?,[],Required Answer,LBA,2025-26,Answer in Two Sentences,67449b18065a2c5cd2dca5c1,7,False,46.42857142857143,science_7.pdf,And
6982ff0697c92115623a5897,science,7,3.0,Motion and Time,english,Average,short_answer,2.0,What are the types of motion?,[],Required Answer,LBA,2025-26,Answer in Two Sentences,67449b18065a2c5cd2dca5c1,7,False,46.15384615384615,science_7.pdf,And
6982ff0697c92115623a5898,science,7,3.0,Motion and Time,english,Average,short_answer,2.0,What is the relationship between speed and direction?,[],Required Answer,LBA,2025-26,Answer in Two Sentences,67449b18065a2c5cd2dca5c1,7,False,47.16981132075472,science_7.pdf,And
6982ff0697c92115623a5894,science,7,3.0,Motion and Time,english,Average,short_answer,1.0,What is the relationship between speed and time?,[],Required Answer,LBA,2025-26,One Sentence Answers,67449b18065a2c5cd2dca5c1,7,False,47.916666666666664,science_7.pdf,And
6982ff0697c92115623a589a,science,7,3.0,Motion and Time,english,Difficult,short_answer,2.0,Why is speed calculated by Distance ÷ Time?,[],Required Answer,LBA,2025-26,Answer in Two Sentences,67449b18065a2c5cd2dca5c1,7,False,43.90243902439024,science_7.pdf,And
6982ff0697c92115623a589d,science,7,3.0,Motion and Time,english,Difficult,fill_in_the_blank,3.0,Explain the difference between speed and velocity.,[],Required Answer,LBA,2025-26,Answer in Three Sentences,67449b18065a2c5cd2dca5c1,7,False,43.99999999999999,science_7.pdf,And
6982ff0697c92115623a589e,science,7,3.0,Motion and Time,english,Difficult,fill_in_the_blank,3.0,Write the three main types of motion with examples.,[],Required Answer,LBA,2025-26,Answer in Three Sentences,67449b18065a2c5cd2dca5c1,7,False,41.17647058823529,science_7.pdf,And
6982ff0697c92115623a58a5,science,7,3.0,Motion and Time,english,Difficult,fill_in_the_blank,1.0,"If a bus travels at a speed of 60 km/h for 2.5 hours, how much distance has it covered?",[],Required Answer,LBA,2025-26,Short Answers,67449b18065a2c5cd2dca5c1,7,False,41.379310344827594,science_7.pdf,And
6982ff0697c92115623a58a6,science,7,3.0,Motion and Time,english,Difficult,fill_in_the_blank,1.0,A bicycle travels 5 km in 20 minutes. What is its average speed?,[],Required Answer,LBA,2025-26,Short Answers,67449b18065a2c5cd2dca5c1,7,False,46.875,science_7.pdf,And
6982ff0697c92115623a58a7,science,7,3.0,Motion and Time,english,Difficult,fill_in_the_blank,1.0,"A car covered a distance of 90 km in 2 hours. Then it traveled 60 km in 1 hour. What is 
the total average speed?",[],Required Answer,LBA,2025-26,Short Answers,67449b18065a2c5cd2dca5c1,7,False,40.57971014492754,science_7.pdf,And
6982ff0697c92115623a58a8,science,7,3.0,Motion and Time,english,Difficult,fill_in_the_blank,1.0,"If a person walks at a speed of 1.5 m/s, how far will they travel in 10 seconds?",[],Required Answer,LBA,2025-26,Short Answers,67449b18065a2c5cd2dca5c1,7,False,40.0,science_7.pdf,And
6982ff0697c92115623a58aa,science,7,3.0,Motion and Time,english,Average,fill_in_the_blank,1.0,In-school Activity:,[],Required Answer,LBA,2025-26,Short Answers,67449b18065a2c5cd2dca5c1,7,True,57.89473684210527,science_7.pdf,And
6982ff0697c92115623a5899,science,7,3.0,Motion and Time,english,Difficult,short_answer,2.0,What is the average speed of a car that travels 60 km in one hour?,[],Required Answer,LBA,2025-26,Answer in Two Sentences,67449b18065a2c5cd2dca5c1,7,False,42.42424242424242,science_7.pdf,And
6982ff0697c92115623a58a1,science,7,3.0,Motion and Time,english,Difficult,fill_in_the_blank,4.0,Calculate the speed: A bike travelled 10 km in 20 minutes. What is its average speed?,[],Required Answer,LBA,2025-26,Answer in Four Sentences,67449b18065a2c5cd2dca5c1,7,False,42.352941176470594,science_7.pdf,And
6982ff0697c92115623a58a2,science,7,3.0,Motion and Time,english,Difficult,fill_in_the_blank,5.0,"A border is 90 km away. A bus reaches it in 3 hours. Calculate the average speed of 
the bus.",[],Required Answer,LBA,2025-26,Short Answers,67449b18065a2c5cd2dca5c1,7,False,41.02564102564102,science_7.pdf,And
6982ff0697c92115623a58a3,science,7,3.0,Motion and Time,english,Difficult,fill_in_the_blank,5.0,Explain the importance of time.,[],Required Answer,LBA,2025-26,Short Answers,67449b18065a2c5cd2dca5c1,7,False,45.16129032258065,science_7.pdf,And
6982ff0697c92115623a58a4,science,7,3.0,Motion and Time,english,Difficult,fill_in_the_blank,1.0,A vehicle covered a distance of 120 km in 3 hours. Calculate its average speed.,[],Required Answer,LBA,2025-26,Short Answers,67449b18065a2c5cd2dca5c1,7,False,44.30379746835443,science_7.pdf,And
6982ff0697c92115623a58ac,science,7,3.0,Motion and Time,english,Average,fill_in_the_blank,1.0,"Distance-Time Graph Activity: The details of the distance traveled by a person are 
given below. Draw a Distance-Time Graph based on the following time and distances: 
0 minutes – 0 m 5 minutes – 250 m 10 minutes – 500 m 15 minutes – 500 m 20 
minutes – 750 m. At what time was the person stationary in this motion?",[],Required Answer,LBA,2025-26,Short Answers,67449b18065a2c5cd2dca5c1,7,False,38.77068557919622,science_7.pdf,And
